<?xml version="1.0"?>
<!--
/**
* +- - - - - - - - - - - - - - - - - - - - - - - - - - - - - - - - - - +
* | Squiz.net Open Source Licence                                      |
* +- - - - - - - - - - - - - - - - - - - - - - - - - - - - - - - - - - +
* | Copyright (c), 2003 Squiz Pty Ltd (ABN 77 084 670 600).            |
* +- - - - - - - - - - - - - - - - - - - - - - - - - - - - - - - - - - +
* | This source file may be used subject to, and only in accordance    |
* | with, the Squiz Open Source Licence Agreement found at             |
* | http://www.squiz.net/licence.                                      |
* | Make sure you have read and accept the terms of that licence,      |
* | including its limitations of liability and disclaimers, before     |
* | using this software in any way. Your use of this software is       |
* | deemed to constitute agreement to be bound by that licence. If you |
* | modify, adapt or enhance this software, you agree to assign your   |
* | intellectual property rights in the modification, adaptation and   |
* | enhancement to Squiz Pty Ltd for use and distribution under that   |
* | licence.                                                           |
* +- - - - - - - - - - - - - - - - - - - - - - - - - - - - - - - - - - +
*
* $Id: asset.xsd,v 1.11 2005/06/06 00:39:42 arailean Exp $
*
*/
-->

<xsd:schema xmlns:xsd="http://www.w3.org/2001/XMLSchema">

	<xsd:simpleType name="dtype_package">
		<xsd:restriction base="xsd:string"/>
	</xsd:simpleType>

	<xsd:simpleType name="dtype_type_code">
		<xsd:restriction base="xsd:string">
			<!-- must start with a letter -->
			<xsd:pattern value="[a-zA-Z][a-zA-Z_]+" />
		</xsd:restriction>
	</xsd:simpleType>

	<xsd:simpleType name="dtype_version">
		<xsd:restriction base="xsd:string">
			<xsd:pattern value="[0-9]+(\.[0-9]+)+" />
		</xsd:restriction>
	</xsd:simpleType>

	<xsd:simpleType name="dtype_name">
		<xsd:restriction base="xsd:string" />
	</xsd:simpleType>

	<xsd:simpleType name="dtype_description">
		<xsd:restriction base="xsd:string" />
	</xsd:simpleType>

	<xsd:simpleType name="dtype_yes_no">
		<xsd:restriction base="xsd:string">
			<xsd:enumeration value="yes"/>
			<xsd:enumeration value="no"/>
		</xsd:restriction>
	</xsd:simpleType>

	<xsd:simpleType name="dtype_requirement_type">
		<xsd:restriction base="xsd:string">
			<xsd:enumeration value="package"/>
			<xsd:enumeration value="asset"/>
			<xsd:enumeration value="system"/>
		</xsd:restriction>
	</xsd:simpleType>

	<xsd:complexType name="dtype_requirement">
		<xsd:sequence>
			<xsd:element name="code"    type="dtype_type_code"/>
			<xsd:element name="version" type="dtype_version"/>
		</xsd:sequence>
		<xsd:attribute name="type" type="dtype_requirement_type" use="required"/>
	</xsd:complexType>

	<xsd:complexType name="dtype_requirements">
		<xsd:sequence>
			<xsd:element name="requirement" type="dtype_requirement" minOccurs="0" maxOccurs="unbounded"/>
		</xsd:sequence>
	</xsd:complexType>

	<xsd:simpleType name="dtype_flash_menu_path">
		<xsd:restriction base="xsd:string" minOccurs="0" maxOccurs="1" />
	</xsd:simpleType>

	<xsd:complexType name="dtype_asset_info">
		<xsd:sequence>
			<xsd:element name="package"         type="dtype_package"/>
			<xsd:element name="type_code"       type="dtype_type_code"/>
			<xsd:element name="version"         type="dtype_version"/>
			<xsd:element name="name"            type="dtype_name"/>
			<xsd:element name="description"     type="dtype_description"/>
			<xsd:element name="instantiable"    type="dtype_yes_no"/>
			<xsd:element name="allowed_access"  type="dtype_allowed_access"/>
			<xsd:element name="parent_type"     type="dtype_type_code"/>
			<xsd:element name="requirements"    type="dtype_requirements"/>
			<xsd:element name="flash_menu_path" type="dtype_flash_menu_path"/>
		</xsd:sequence>
	</xsd:complexType>

	<xsd:element name="asset_info" type="dtype_asset_info" />

</xsd:schema>
