<?xml version='1.0' encoding='UTF-8' ?>
<?xml-stylesheet href="../../asset.xsl" type="text/xsl"?>

<!--
/**
* +- - - - - - - - - - - - - - - - - - - - - - - - - - - - - - - - - - +
* | This MySource Matrix CMS file is Copyright (c) Squiz Pty Ltd       |
* | ACN 084 670 600                                                    |
* +- - - - - - - - - - - - - - - - - - - - - - - - - - - - - - - - - - +
* | IMPORTANT: Your use of this Software is subject to the terms of    |
* | the Licence provided in the file licence.txt. If you cannot find   |
* | this file please contact Squiz (www.squiz.net) so we may provide   |
* | you a copy.                                                        |
* +- - - - - - - - - - - - - - - - - - - - - - - - - - - - - - - - - - +
*
* $Id: asset.xml,v 1.3 2010/05/05 07:13:23 ewang Exp $
*
*/
-->

<asset_info xmlns:xsi="http://www.w3.org/2001/XMLSchema-instance" xsi:noNamespaceSchemaLocation="../../asset.xsd">
	<package>ipb</package>
	<type_code>ipb_post</type_code>
	<version>0.1</version>
	<name>IPB Post</name>
	<description>An asset to represent a topic in Invision Power Board</description>
	<instantiable>no</instantiable>
	<allowed_access>system</allowed_access>
	<parent_type>ipb_topic</parent_type>
	<requirements />
	<flash_menu_path>IPB</flash_menu_path>
</asset_info>
