<?xml version='1.0' encoding='UTF-8' ?>
<?xml-stylesheet href="../../asset.xsl" type="text/xsl"?>

<asset_info xmlns:xsi="http://www.w3.org/2001/XMLSchema-instance" xsi:noNamespaceSchemaLocation="../../asset.xsd">
	<package>__core__</package>
	<type_code>design_area_colourise_image</type_code>
	<version>0.1</version>
	<name>Colourise Image Design Area</name>
	<description>This design area allows you to let the system user colourise images</description>
	<instantiable>yes</instantiable>
	<system_only>yes</system_only>
	<parent_type>design_area</parent_type>
	<requirements>
		<requirement type="asset">
			<code>design_area</code>
			<version>0.1</version>
		</requirement>
	</requirements>
</asset_info>
