<?xml version='1.0' encoding='UTF-8' ?>
<?xml-stylesheet href="../../asset.xsl" type="text/xsl"?>

<asset_info xmlns:xsi="http://www.w3.org/2001/XMLSchema-instance" xsi:noNamespaceSchemaLocation="../../asset.xsd">
	<package>__core__</package>
	<type_code>design_area_menu_recursive</type_code>
	<version>0.1</version>
	<name>Recursive Menu Design Area</name>
	<description>Menuing design area used to allow the recursivly generate menus</description>
	<instantiable>yes</instantiable>
	<allowed_access>system</allowed_access>
	<parent_type>design_area_menu_type</parent_type>
	<requirements>
		<requirement type="asset">
			<code>design_area_menu_type</code>
			<version>0.1</version>
		</requirement>
	</requirements>
	<flash_menu_path/>
</asset_info>
