<?xml version='1.0' encoding='UTF-8' ?>
<?xml-stylesheet href="../../asset.xsl" type="text/xsl"?>

<!--
/**
* +- - - - - - - - - - - - - - - - - - - - - - - - - - - - - - - - - - +
* | Squiz.net Open Source Licence                                      |
* +- - - - - - - - - - - - - - - - - - - - - - - - - - - - - - - - - - +
* | Copyright (c), 2003 Squiz Pty Ltd (ABN 77 084 670 600).            |
* +- - - - - - - - - - - - - - - - - - - - - - - - - - - - - - - - - - +
* | This source file may be used subject to, and only in accordance    |
* | with, the Squiz Open Source Licence Agreement found at             |
* | http://www.squiz.net/licence.                                      |
* | Make sure you have read and accept the terms of that licence,      |
* | including its limitations of liability and disclaimers, before     |
* | using this software in any way. Your use of this software is       |
* | deemed to constitute agreement to be bound by that licence. If you |
* | modify, adapt or enhance this software, you agree to assign your   |
* | intellectual property rights in the modification, adaptation and   |
* | enhancement to Squiz Pty Ltd for use and distribution under that   |
* | licence.                                                           |
* +- - - - - - - - - - - - - - - - - - - - - - - - - - - - - - - - - - +
*
* $Id: asset.xml,v 1.1 2006/04/27 03:19:36 lwright Exp $
*
*/
-->

<asset_info xmlns:xsi="http://www.w3.org/2001/XMLSchema-instance" xsi:noNamespaceSchemaLocation="../../asset.xsd">
	<package>cms</package>
	<type_code>cron_job_manage_pending_accounts</type_code>
	<version>0.2</version>
	<name>Manage Pending Accounts Cron Job</name>
	<description>Manages pending accounts created by account managers. This cron job handles the resending of validation emails to, or deletion of pending accounts that remain pending for an extended period of time.</description>
	<instantiable>yes</instantiable>
	<allowed_access>system</allowed_access>
	<parent_type>cron_job</parent_type>
	<requirements />
	<flash_menu_path/>
</asset_info>
