<!--
/**
* Copyright (c) 2003 - Squiz Pty Ltd
*
* $Id: asset.xml,v 1.4 2003/09/26 05:26:29 brobertson Exp $
* $Name: not supported by cvs2svn $
*/
-->

<?xml version='1.0' encoding='UTF-8' ?>
<?xml-stylesheet href="../../asset.xsl" type="text/xsl"?>

<asset_info xmlns:xsi="http://www.w3.org/2001/XMLSchema-instance" xsi:noNamespaceSchemaLocation="../../asset.xsd">
	<package>__core__</package>
	<type_code>backend_user</type_code>
	<version>0.1</version>
	<name>Backend User</name>
	<description>Backend Users are the only users that have access to the backend</description>
	<instantiable>yes</instantiable>
	<allowed_access>system_user</allowed_access>
	<parent_type>user</parent_type>
	<requirements>
		<requirement type="asset">
			<code>user</code>
			<version>0.1</version>
		</requirement>
	</requirements>
	<flash_menu_path>Users</flash_menu_path>
</asset_info>
