<?xml version='1.0' encoding='UTF-8' ?>
<?xml-stylesheet href="../../asset.xsl" type="text/xsl"?>

<!--
/**
* Copyright (c) 2003 - Squiz Pty Ltd
*
* $Id: asset.xml,v 1.5 2003/11/12 18:02:27 brobertson Exp $
* $Name: not supported by cvs2svn $
*/
-->

<asset_info xmlns:xsi="http://www.w3.org/2001/XMLSchema-instance" xsi:noNamespaceSchemaLocation="../../asset.xsd">
	<package>__core__</package>
	<type_code>design_area_constant_button</type_code>
	<version>0.2</version>
	<name>Constant Button Design Area</name>
	<description>This design area allows constant links to be made in the design</description>
	<instantiable>yes</instantiable>
	<allowed_access>system</allowed_access>
	<parent_type>design_area</parent_type>
	<requirements>
		<requirement type="asset">
			<code>design_area</code>
			<version>0.1</version>
		</requirement>
	</requirements>
	<flash_menu_path/>
</asset_info>
