<?xml version='1.0' encoding='UTF-8' ?>
<?xml-stylesheet href="../../asset.xsl" type="text/xsl"?>

<asset_info xmlns:xsi="http://www.w3.org/2001/XMLSchema-instance" xsi:noNamespaceSchemaLocation="../../asset.xsd">
	<package>cms</package>
	<type_code>content_type</type_code>
	<version>0.1</version>
	<name>Content Type</name>
	<description>Content Type, base class for editing cell contents</description>
	<instantiable>no</instantiable>
	<system_only>yes</system_only>
	<parent_type>asset</parent_type>
	<requirements>
		<requirement type="asset">
			<code>bodycopy_table</code>
			<version>0.1</version>
		</requirement>
	</requirements>
</asset_info>
