<?xml version='1.0' encoding='UTF-8' ?>
<?xml-stylesheet href="../../asset.xsl" type="text/xsl"?>

<!--
/**
* Copyright (c) 2003 - Squiz Pty Ltd
*
* $Id: asset.xml,v 1.4 2003/09/26 06:41:21 brobertson Exp $
* $Name: not supported by cvs2svn $
*/
-->

<asset_info xmlns:xsi="http://www.w3.org/2001/XMLSchema-instance" xsi:noNamespaceSchemaLocation="../../asset.xsd">
	<package>__core__</package>
	<type_code>cron_job</type_code>
	<version>0.1</version>
	<name>Cron Job</name>
	<description>The Cron Job, a single cron job to be queued and executed by the Cron Manager</description>
	<instantiable>no</instantiable>
	<allowed_access>system</allowed_access>
	<parent_type>asset</parent_type>
	<requirements />
	<flash_menu_path/>
</asset_info>
