<!--
/**
* Copyright (c) 2003 - Squiz Pty Ltd
*
* $Id: asset.xml,v 1.4 2003/09/26 05:26:26 brobertson Exp $
* $Name: not supported by cvs2svn $
*/
-->

<?xml version='1.0' encoding='UTF-8' ?>
<?xml-stylesheet href="../../../packages/asset.xsl" type="text/xsl"?>

<asset_info xmlns:xsi="http://www.w3.org/2001/XMLSchema-instance" xsi:noNamespaceSchemaLocation="../../../packages/asset.xsd">
	<package>__core__</package>
	<type_code>metadata_schema</type_code>
	<version>0.1</version>
	<name>Metadata Schema</name>
	<description>Metadata Schema, define a schema for metadata to be attached to assets in the system</description>
	<instantiable>yes</instantiable>
	<allowed_access>backend_user</allowed_access>
	<parent_type>folder</parent_type>
	<requirements />
	<flash_menu_path>Schemas</flash_menu_path>
</asset_info>
