<?xml version='1.0' encoding='UTF-8' ?>
<?xml-stylesheet href="../../asset.xsl" type="text/xsl"?>

<asset_info xmlns:xsi="http://www.w3.org/2001/XMLSchema-instance" xsi:noNamespaceSchemaLocation="../../asset.xsd">
	<package>cms</package>
	<type_code>bodycopy</type_code>
	<version>0.1</version>
	<name>Bodycopy</name>
	<description>BodyCopy Object, create tables to format content</description>
	<instantiable>yes</instantiable>
	<allowed_access>system</allowed_access>
	<parent_type>asset</parent_type>
	<requirements>
		<requirement type="system">
			<code>Resolve</code>
			<version>0.1.0</version>
		</requirement>
	</requirements>
</asset_info>
