<?xml version='1.0' encoding='UTF-8' ?>
<?xml-stylesheet href="../../asset.xsl" type="text/xsl"?>
<!--
/**
* +- - - - - - - - - - - - - - - - - - - - - - - - - - - - - - - - - - +
* | This MySource Matrix CMS file is Copyright (c) Squiz Pty Ltd       |
* | ACN 084 670 600                                                    |
* +- - - - - - - - - - - - - - - - - - - - - - - - - - - - - - - - - - +
* | IMPORTANT: Your use of this Software is subject to the terms of    |
* | the Licence provided in the file licence.txt. If you cannot find   |
* | this file please contact Squiz (www.squiz.net) so we may provide   |
* | you a copy.                                                        |
* +- - - - - - - - - - - - - - - - - - - - - - - - - - - - - - - - - - +
*
* $Id: asset.xml,v 1.2 2010/11/05 04:47:48 csmith Exp $
*
*/
-->

<asset_info xmlns:xsi="http://www.w3.org/2001/XMLSchema-instance" xsi:noNamespaceSchemaLocation="../../asset.xsd">
	<package>squiz_suite</package>
	<type_code>suite_manager</type_code>
	<version>0.1</version>
	<name>Squiz Suite Manager</name>
	<description>Squiz Suite Manager organises connections to Squiz Suite products</description>
	<instantiable>no</instantiable>
	<allowed_access>backend_user</allowed_access>
	<parent_type>page</parent_type>
	<requirements>
		<requirement type="system_asset">
			<code>web_folder_web_services</code>
			<version>0.1</version>
		</requirement>
    </requirements>
	<flash_menu_path />
</asset_info>
