<?xml version='1.0' encoding='UTF-8' ?>
<?xml-stylesheet href="../../../packages/asset.xsl" type="text/xsl"?>

<!--
/**
* +- - - - - - - - - - - - - - - - - - - - - - - - - - - - - - - - - - +
* | This MySource Matrix CMS file is Copyright (c) Squiz Pty Ltd       |
* | ACN 084 670 600                                                    |
* +- - - - - - - - - - - - - - - - - - - - - - - - - - - - - - - - - - +
* | IMPORTANT: Your use of this Software is subject to the terms of    |
* | the Licence provided in the file licence.txt. If you cannot find   |
* | this file please contact Squiz (www.squiz.net) so we may provide   |
* | you a copy.                                                        |
* +- - - - - - - - - - - - - - - - - - - - - - - - - - - - - - - - - - +
*
* $Id: asset.xml,v 1.1 2009/11/27 05:39:53 lwright Exp $
*
*/
-->

<asset_info xmlns:xsi="http://www.w3.org/2001/XMLSchema-instance" xsi:noNamespaceSchemaLocation="../../../packages/asset.xsd">
	<package>__core__</package>
	<type_code>workflow_stream</type_code>
	<version>0.1</version>
	<name>Workflow Stream</name>
	<description>Defines a possible stream of steps to be taken to approve a workflow. A Workflow Schema may have one or more of these, to define alternate approval paths that those with Admin permission to an applied asset can select when applying for approval.</description>
	<instantiable>yes</instantiable>
	<allowed_access>system</allowed_access>
	<parent_type>asset</parent_type>
	<requirements />
	<flash_menu_path/>
</asset_info>
