<?xml version='1.0' encoding='UTF-8' ?>
<?xml-stylesheet href="../../../asset.xsl" type="text/xsl"?>

<!--
/**
* +- - - - - - - - - - - - - - - - - - - - - - - - - - - - - - - - - - +
* | Squiz.net Commercial Module Licence                                |
* +- - - - - - - - - - - - - - - - - - - - - - - - - - - - - - - - - - +
* | Copyright (c) Squiz Pty Ltd (ACN 084 670 600).                     |
* +- - - - - - - - - - - - - - - - - - - - - - - - - - - - - - - - - - +
* | This source file is not open source or freely usable and may be    |
* | used subject to, and only in accordance with, the Squiz Commercial |
* | Module Licence.                                                    |
* | Please refer to http://www.squiz.net/licence for more information. |
* +- - - - - - - - - - - - - - - - - - - - - - - - - - - - - - - - - - +
*
* $Id: asset.xml,v 1.1 2005/07/20 01:17:55 arailean Exp $
*
*/
-->
<asset_info xmlns:xsi="http://www.w3.org/2001/XMLSchema-instance" xsi:noNamespaceSchemaLocation="../../../asset.xsd">
	<package>ecommerce</package>
	<type_code>ecommerce_delivery_method</type_code>
	<version>0.1</version>
	<name>Ecommerce Delivery Method</name>
	<description>Delivery Method Object, the base class for creating delivery methods and processing them</description>
	<instantiable>no</instantiable>
	<allowed_access>backend_user</allowed_access>
	<parent_type>asset</parent_type>
	<requirements>
		<requirement type="system">
			<code>System</code>
			<version>3.7.0</version>
		</requirement>
	</requirements>
	<flash_menu_path/>
</asset_info>
