<?xml version='1.0' encoding='UTF-8' ?>
<?xml-stylesheet href="../../asset.xsl" type="text/xsl"?>
<!--
/**
* Copyright (c) 2003 - Squiz Pty Ltd
*
* $Id: asset.xml,v 1.1.1.1 2003/10/08 01:20:58 dwong Exp $
* $Name: not supported by cvs2svn $
*/
-->

<asset_info xmlns:xsi="http://www.w3.org/2001/XMLSchema-instance" xsi:noNamespaceSchemaLocation="../../asset.xsd">
	<package>search</package>
	<type_code>design_area_searchbox</type_code>
	<version>0.1</version>
	<name>Searchbox design area</name>
	<description>Input textbox to be used in designs for searching.</description>
	<instantiable>yes</instantiable>
	<allowed_access>system</allowed_access>
	<parent_type>design_area</parent_type>
	<requirements>
		<requirement type="asset">
			<code>design_area</code>
			<version>0.1</version>
		</requirement>
	</requirements>
	<flash_menu_path />
</asset_info>
