<?xml version='1.0' encoding='UTF-8' ?>
<?xml-stylesheet href="../../asset.xsl" type="text/xsl"?>

<!--
/**
* +- - - - - - - - - - - - - - - - - - - - - - - - - - - - - - - - - - +
* | Squiz.net Commercial Module Licence                                |
* +- - - - - - - - - - - - - - - - - - - - - - - - - - - - - - - - - - +
* | Copyright (c) Squiz Pty Ltd (ACN 084 670 600).                     |
* +- - - - - - - - - - - - - - - - - - - - - - - - - - - - - - - - - - +
* | This source file is not open source or freely usable and may be    |
* | used subject to, and only in accordance with, the Squiz Commercial |
* | Module Licence.                                                    |
* | Please refer to http://www.squiz.net/licence for more information. |
* +- - - - - - - - - - - - - - - - - - - - - - - - - - - - - - - - - - +
*
* $Id: asset.xml,v 1.2 2005/11/21 04:34:05 dmckee Exp $
*
*/
-->

<asset_info xmlns:xsi="http://www.w3.org/2001/XMLSchema-instance" xsi:noNamespaceSchemaLocation="../../asset.xsd">
	<package>cms</package>
	<type_code>page_multiple_page_page</type_code>
	<version>0.1</version>
	<name>Multiple Page Page</name>
	<description>Multiple Page Page, Is a part of the Multiple Page</description>
	<instantiable>no</instantiable>
	<allowed_access>backend_user</allowed_access>
	<parent_type>bodycopy</parent_type>
	<requirements>
		<requirement type="asset">
			<code>page</code>
			<version>0.2</version>
		</requirement>
		<requirement type="asset">
			<code>bodycopy</code>
			<version>0.1</version>
		</requirement>
		<requirement type="asset">
			<code>page_multiple_page</code>
			<version>0.1</version>
		</requirement>
	</requirements>
	<flash_menu_path>Pages</flash_menu_path>
</asset_info>
